<?xml version="1.0"?>
<BookStore
        xmlns:xsi="http://www.w3.org/2001/XMLSchema-instance"
        xmlns="https://jets.iti.gov.eg/xml/bookstore"
        xsi:schemaLocation="https://jets.iti.gov.eg/xml/bookstore BookStore.xsd">
    <Book>
        <Title>Days</Title>
        <Author>Taha Hussien</Author>
        <Date>1992-01-01</Date>
        <ISBN>939kd9</ISBN>
        <Publisher>Dar El-Nashr</Publisher>
    </Book>

    <Book>
        <Title>Days</Title>
        <Author>Taha Hussien</Author>
        <Date>1992-01-01</Date>
        <ISBN>939kd9</ISBN>
        <Publisher>Dar El-Nashr</Publisher>
    </Book>
</BookStore>

